Brand,Protein,Fat,Carbs
Taste of the Wild Prey Dog Food Review (Dry),27%,15%,Not Available
Tender and True Dog Food Review (Dry),26%,16%,Not Available
The Honest Kitchen Dog Food Review (Dehydrated),25%,14%,Not Available
The Honest Kitchen Whole Food Clusters Review (Dry),26%,15%,Not Available
Tiki Dog Aloha Petites Dog Food Review (Dry),27%,16%,Not Available
TimberWolf Legends Dog Food Review (Dry),40%,18%,Not Available
TLC Whole Life Dog Food Review (Dry),26%,16%,Not Available
Tops Dog Food Review (Dry),26%,11%,Not Available
Total Canine Dog Food Review (Dry),24%,18%,Not Available
Trader Joe’s Dog Food Review (Dry),23%,12%,Not Available
Triumph Wild Spirit Dog Food Review (Dry),25%,15%,Not Available
True Acre Dog Food Review (Dry),24%,13%,Not Available
Tuffy’s Dog Food Review (Dry),21%,10%,Not Available
Tuffy’s Gold Dog Food Review (Dry),26%,18%,Not Available
Tuscan Natural Carne Dog Food Review (Dry),35%,20%,Not Available
Tuscan Natural Harvest Dog Food Review (Dry),24%,14%,Not Available
Tuscan Natural Simply Pure Dog Food Review (Dry),21%,11%,Not Available
Twin Pet Dog Food Review (Dry),17%,7%,Not Available
V-Dog Dog Food Review (Dry),24%,9%,Not Available
Valens Dog Food Review (Dry),30%,18%,Not Available
Valiant Pet Nutrition Raw Dog Food Review (Freeze-Dried),36%,41%,Not Available
Variety Dog Food Review (Dry),21%,10%,Not Available
VeRUS Dog Food Review (Dry),24%,15%,Not Available
Victor Classic Dog Food Review (Dry),30%,20%,Not Available
Victor Purpose Dog Food Review (Dry),38%,18%,Not Available
Victor Select Dog Food Review (Dry),33%,16%,Not Available
Wag Dog Food Review (Dry),35%,15%,Not Available
Wegmans Bruiser Dog Food Review (Dry),21%,10%,Not Available
Wegmans Nature Dog Food Review (Dry),25%,15%,Not Available
Wellness Complete Health Dog Food Review (Dry),24%,12%,Not Available
Wellness Complete Health Grain Free Dog Food Review (Dry),26%,12%,Not Available
Wellness Core Digestive Health Dog Food Review (Dry),30%,12%,Not Available
Wellness Core Grain Free Dog Food Review (Dry),34%,16%,Not Available
Wellness Core RawRev Dog Food Review (Dry),38%,17%,Not Available
Wellness Core Reduced Fat Dog Food Review (Dry),33%,10%,Not Available
Wellness Core with Wholesome Grains Dog Food Review (Dry),34%,16%,Not Available
Wellness Simple Limited Ingredient Dog Food Review (Dry),26%,11%,Not Available
Whole Earth Farms Dog Food Review (Dry),25%,14%,Not Available
Whole Earth Farms Grain Free Dog Food Review (Dry),24%,14%,Not Available
Whole Life LifeBites Dog Food Review (Freeze-Dried),49%,25%,Not Available
WholeHearted Grain Free Dog Food Review (Dry),27%,10%,Not Available
Wholesomes Dog Food Review (Dry),24%,14%,Not Available
Wholesomes Grain-Free Dog Food Review (Dry),23%,12%,Not Available
Wishbone Dog Food Review (Dry),26%,12%,Not Available
Wysong Archetype Dog Food Review (Freeze-Dried),48%,21%,Not Available
Wysong Epigen 90 Dog Food Review (Dry),63%,16%,Not Available
Wysong Epigen Dog Food Review (Dry),60%,15%,Not Available
Wysong Original Diets Dog Food Review (Dry),30%,14%,Not Available
Young Again Dog Food Review (Dry),40%,16%,Not Available
Zach’s Quality Dog Food Review (Dry),28%,19%,Not Available
Zignature Dog Food Review (Dry),32%,15%,Not Available
Ziwi Peak Air Dried Dog Food Review (Dehydrated),38%,30%,Not Available
Zoe Dog Food Review (Dry),24%,14%,Not Available
