Brand,Protein,Fat,Carbs
4Health Dog Food Review (Dry),26%,15%,Not Available
4Health Grain Free Dog Food Review (Dry),26%,15%,Not Available
A Pup Above Whole Food Cubies Dog Food Review (Dehydrated),30%,19%,Not Available
Abound Dog Food Review (Dry),22%,13%,Not Available
Acana Classics Dog Food Review | Canada (Dry),29%,17%,Not Available
Acana Dog Food Review (Dry),29%,17%,Not Available
Acana Heritage Dog Food Review | Canada (Dry),31%,17%,Not Available
Acana Highest Protein Dog Food Review (Dry),33%,17%,Not Available
Acana Highest Protein Dog Food Review | Canada (Dry),35%,17%,Not Available
Acana Limited Ingredient Singles Dog Food Review (Dry),31%,17%,Not Available
Acana Singles Dog Food Review | Canada (Dry),31%,15%,Not Available
Addiction Dog Food Review (Dehydrated),22%,12%,Not Available
Addiction Dog Food Review (Dry),24%,12%,Not Available
Adirondack Dog Food Review (Dry),30%,20%,Not Available
Alpo Dog Food Review (Dry),18%,9%,Not Available
American Journey Limited Ingredient Dog Food Review (Dry),25%,12%,Not Available
American Journey Protein & Grains Dry Dog Food Review,25%,15%,Not Available
American Natural Premium Dog Food Review (Dry),25%,16%,Not Available
American Natural Premium Grain Free Dog Food Review (Dry),28%,15%,Not Available
Ancestry Dog Food Review (Dry),32%,16%,Not Available
Annamaet Dog Food Review (Dry),25%,14%,Not Available
Annamaet Grain Free Dog Food Review (Dry),30%,16%,Not Available
Apex Dog Food Review (Dry),26%,18%,Not Available
Artemis Fresh Mix Dog Food Review (Dry),23%,14%,Not Available
Artemis Osopure Grain Free Limited Ingredient Formula Dog Food Review (Dry),24%,14%,Not Available
Authority Dog Food Review (Dry),30%,20%,Not Available
Authority Grain Free Dog Food Review (Dry),25%,12%,Not Available
Authority Tender Blends Dog Food Review (Dry),25%,12%,Not Available
AvoDerm Natural Dog Food Review (Dry),23%,13%,Not Available
AvoDerm Natural Grain Free Dog Food Review (Dry),27%,12%,Not Available
AvoDerm Natural Revolving Menu Dog Food Review (Dry),26%,16%,Not Available
Azmira Dog Food Review (Dry),22%,8%,Not Available
Beaverdam Dog Food Review (Dry),27%,12%,Not Available
Ben’s Best Dog Food Review (Dry),21%,8%,Not Available
Bench and Field Dog Food Review (Dry),24%,15%,Not Available
Beneful Dog Food Review (Dry),23%,12%,Not Available
Berkley Jensen Dog Food Review (Dry),25%,14%,Not Available
Big Red Dog Food Review (Dry),22%,12%,Not Available
Bil-Jac Dog Food Review (Dry),27%,18%,Not Available
Bil-Jac Farmer’s Bounty Dog Food Review (Dry),28%,18%,Not Available
Bil-Jac Picky No More Dog Food Review (Dry),26%,15%,Not Available
Bixbi Liberty Dog Food Review (Dry),26%,17%,Not Available
Bixbi Rawbble Dog Food Review (Dry),30%,17%,Not Available
Black Gold Explorer Dog Food Review (Dry),26%,18%,Not Available
Black Gold Explorer Grain Free Dog Food Review (Dry),30%,16%,Not Available
Blackwood All Life Stages Special Diet Dog Food Review (Dry),25%,14%,Not Available
Blackwood Everyday Recipes Dog Food Review (Dry),24%,14%,Not Available
Blackwood Original Recipe Dog Food Review (Dry),23%,12%,Not Available
Blue Buffalo Basics Dog Food Review (Dry),20%,12%,Not Available
Blue Buffalo Basics Grain Free Dog Food Review (Dry),20%,12%,Not Available
Blue Buffalo Dog Food Review,24%,14%,Not Available
Blue Buffalo Freedom Grain Free Dog Food Review (Dry),24%,14%,Not Available
Blue Buffalo Wilderness Nature’s Evolutionary Diet Dog Food Review (Dry),34%,15%,Not Available
Blue Buffalo Wilderness Rocky Mountain Recipe Dog Food Review (Dry),30%,15%,Not Available
Blue Seal Classics Dog Food Review (Dry),26%,12%,Not Available
Blue Seal EnTrust Dog Food Review (Dry),24%,14%,Not Available
Boka Dog Food Review (Dry),25%,15%,Not Available
Bonafide Dog Food Review (Dry),24%,12%,Not Available
Boreal Original Grain Free Dog Food Review (Dry),28%,18%,Not Available
Born Free Dog Food Review (Dry),27%,16%,Not Available
Bravo Homestyle Complete Dog Food Review (Freeze-Dried),38%,13%,Not Available
Breakaway Dog Food Review (Dry),23%,10%,Not Available
Brothers Complete Advanced Allergy Care Dog Food Review (Dry),36%,16%,Not Available
Brothers Complete Dog Food Review (Dry),36%,15%,Not Available
Bully Max High Performance Dog Food Review (Dry),30%,20%,Not Available
By Nature Dog Food Review (Dry),29%,17%,Not Available
Caliber Dog Food Review (Dry),21%,10%,Not Available
Canidae Dog Food Review,24%,10%,Not Available
Canidae Pure Grain Free Dog Food Review (Dry),30%,14%,Not Available
Canidae Under the Sun Grain Free Dog Food Review (Dry),26%,11%,Not Available
Canine Caviar Limited Ingredient Dog Food Review (Dry),25%,15%,Not Available
Canine Naturals Dog Food Review (Dry),25%,14%,Not Available
Canine Naturals Grain Free Dog Food Review (Dry),28%,12%,Not Available
CaniSource Grand Cru Dog Food Review (Dehydrated),27%,16%,Not Available
Carna4 Dog Food Review (Dry),28%,17%,Not Available
Castor and Pollux Organix Grain-Free Dog Food Review (Dry),26%,15%,Not Available
Castor and Pollux Pristine Grain Free Dog Food Review (Dry),32%,16%,Not Available
Cesar Dog Food Review (Dry),26%,13%,Not Available
Chicken Soup for the Soul Dog Food Review (Dry),25%,13%,Not Available
Chicken Soup for the Soul Grain Free Dog Food Review (Dry),27%,14%,Not Available
Costco Kirkland Dog Food Review (Dry),26%,16%,Not Available
Country Magic Dog Food Review (Dry),21%,10%,Not Available
Country Squire Dog Food Review (Dry),21%,10%,Not Available
Country Vet Choice Dog Food Review | Rating | Recalls,26%,18%,Not Available
Country Vet Naturals Dog Food Review (Dry),24%,14%,Not Available
Country Vet Premium Dog Food Review (Dry),26%,18%,Not Available
Crave Dog Food Review (Dry),34%,17%,Not Available
Dave’s Dog Food Review (Dry),25%,10%,Not Available
Defender Dog Food Review (Dry),21%,8%,Not Available
Diamond Care Dog Food Review (Dry),25%,13%,Not Available
Diamond Dog Food Review (Dry),22%,12%,Not Available
Diamond Naturals Dog Food Review (Dry),25%,15%,Not Available
Diamond Naturals Grain Free Dog Food Review (Dry),24%,14%,Not Available
Doc’s Choice Dog Food Review (Dry),23%,13%,Not Available
Dog Power Dog Food Review (Dry),26%,16%,Not Available
Doggy Bag Dog Food Review (Dry),18%,6%,Not Available
Dogswell Nutrisca Dog Food Review (Dry),30%,16%,Not Available
Dr. Gary’s Best Breed Dog Food Review (Dry),25%,13%,Not Available
Dr. Gary’s Best Breed Grain Free Dog Food Review (Dry),30%,16%,Not Available
Dr. Marty Dog Food Review (Freeze-Dried Raw),37%,27%,Not Available
Dr. Tim’s Dog Food Review (Dry),26%,16%,Not Available
Dr. Tim’s Grain Free Dog Food Review (Dry),32%,18%,Not Available
Dynamite Dog Food Review (Dry),24%,16%,Not Available
Eagle Pack Dog Food Review (Dry),25%,12%,Not Available
Earthborn Holistic Grain Free Dog Food Review (Dry),32%,18%,Not Available
Earthborn Holistic Primitive Natural Dog Food Review (Dry),32%,18%,Not Available
Earthborn Holistic Unrefined Dog Food Review (Dry),24%,15%,Not Available
Earthborn Holistic Venture Limited Ingredient Diets Dog Food Review (Dry),26%,13%,Not Available
Essence Dog Food Review (Dry),35%,17%,Not Available
Eukanuba Dog Food Review (Dry),23%,13%,Not Available
Eukanuba Premium Performance Dog Food Review (Dry),30%,20%,Not Available
Evanger’s Dog Food Review (Dry),26%,4%,Not Available
Evanger’s Grain Free Dog Food Review (Dry),33%,16%,Not Available
Evanger’s Hi Bio Dog Food Review (Dry),28%,17%,Not Available
Evolution Diet Dog Food Review (Dry),28%,14%,Not Available
Evolve Classic Dog Food Review (Dry),25%,15%,Not Available
Evolve Grain Free Dog Food Review (Dry),25%,15%,Not Available
Ex-Cell Pro Dog Food Review (Dry),26%,12%,Not Available
Exclusive Dog Food Review (Dry),25%,13%,Not Available
Extreme Dog Fuel Elite Nutrition Dog Food Review (Dry),26%,18%,Not Available
Farmina Ancestral Grain Dog Food Review (Dry),30%,18%,Not Available
Farmina Prime Dog Food Review (Dry),34%,18%,Not Available
Farmina Pumpkin Dog Food Review (Dry),30%,18%,Not Available
First Choice Dog Food Review (Dry),23%,13%,Not Available
FirstMate Dog Food Review (Dry),28%,12%,Not Available
FirstMate Grain-Free Dog Food Review (Dry),24%,13%,Not Available
Forza10 Legend Dog Food Review (Dry),30%,16%,Not Available
Fromm Dog Food Review,25%,16%,Not Available
Fromm Family Classics Dog Food Review (Dry),23%,15%,Not Available
Fromm Family Heartland Gold Dog Food Review (Dry),24%,16%,Not Available
Fromm Four Star Nutritionals Dog Food Review (Dry),24%,15%,Not Available
Fromm Four Star Nutritionals Grain-Free Dog Food Review (Dry),29%,18%,Not Available
Fromm Gold Coast Dog Food Review (Dry),25%,10%,Not Available
Full Balance Dog Food Review (Dry),21%,8%,Not Available
Gather Dog Food Review (Dry),30%,15%,Not Available
Gentle Giants Dog Food Review (Dry),22%,9%,Not Available
Go! Solutions Carnivore Dog Food Review (Dry),34%,16%,Not Available
Go! Solutions Sensitivities Limited Ingredient Dog Food Review (Dry),24%,12%,Not Available
Go! Solutions Skin + Coat Care Dog Food Review (Dry),22%,12%,Not Available
Good Dog Complete Dog Food Review (Dry),24%,20%,Not Available
Grandma Lucy’s Artisan Dog Food Review (Freeze-Dried),26%,13%,Not Available
Grandma Lucy’s Pureformance Dog Food Review (Freeze-Dried),36%,15%,Not Available
Grandma Mae’s Country Naturals Dog Food Review (Dry),24%,14%,Not Available
Grandma Mae’s Country Naturals Grain Free Dog Food Review (Dry),26%,14%,Not Available
Gravy Train Dog Food Review (Dry),17%,8%,Not Available
Great Canadian Dog Food Review (Dry),23%,14%,Not Available
Grreat Choice Dog Food Review (Dry),21%,9%,Not Available
H-E-B Heritage Ranch Dog Food Review (Dry),25%,15%,Not Available
H-E-B Heritage Ranch Grain Free Dog Food Review (Dry),26%,15%,Not Available
H-E-B Texas Pets Dog Food Review (Dry),25%,10%,Not Available
Halo Elevate Dog Food (Dry),32%,18%,Not Available
Halo Freeze-Dried Raw Meal Bites Dog Food Review (Freeze-Dried),40%,33%,Not Available
Halo Grain Free Dog Food Review (Dry),27%,15%,Not Available
Halo Holistic Healthy Grains Dog Food Review (Dry),27%,15%,Not Available
Hank’s Dog Food Review (Dry),29%,20%,Not Available
Happy Paws Dog Food Review (Dry),24%,14%,Not Available
Harvest Blend Dog Food Review (Dry),25%,15%,Not Available
Health Extension Dog Food Review (Dry),24%,18%,Not Available
Health Extension Grain Free Dog Food Review (Dry),25%,15%,Not Available
Heartland Reserve Dog Food Review (Dry),18%,7%,Not Available
Hi-Point Dog Food Review (Dry),28%,15%,Not Available
Hi-Standard Premium Performance Dog Food Review (Dry),26%,18%,Not Available
Hi-Standard Pure Grain Free Dog Food Review (Dry),27%,14%,Not Available
Hi-Standard Ultimate Dog Food Review (Dry),26%,16%,Not Available
Hi-Tor Veterinary Select Dog Food Review (Dry),20%,5%,Not Available
Hill’s Healthy Advantage Dog Food Review (Dry),24%,15%,Not Available
Hill’s Prescription Diet B/D Canine Dog Food Review (Dry),19%,14%,Not Available
Hill’s Prescription Diet C/D Canine Dog Food Review (Dry),22%,17%,Not Available
Hill’s Prescription Diet Derm Complete Dog Food Review (Dry),17%,17%,Not Available
Hill’s Prescription Diet Digestive Care I/D Canine Dog Food Review (Dry),27%,14%,Not Available
Hill’s Prescription Diet W/D Canine Dog Food Review (Dry),21%,13%,Not Available
Hill’s Prescription Diet Weight Loss R/D Canine Dog Food Review (Dry),34%,9%,Not Available
Hill’s Prescription Diet Z/D Canine Dog Food Review (Dry),20%,14%,Not Available
Hill’s Science Diet Adult Perfect Weight Dog Food Review (Dry),29%,11%,Not Available
Hill’s Science Diet Adult Plus Dog Food Review (Dry),19%,14%,Not Available
Hill’s Science Diet Dog Food Review,25%,8%,Not Available
Hill’s Science Diet Grain Free Dog Food Review (Dry),25%,18%,Not Available
Hill’s Science Diet Puppy Food Review (Dry),26%,15%,Not Available
Holistic Select Dog Food Review (Dry),25%,13%,Not Available
Holistic Select Grain Free Dog Food Review (Dry),29%,14%,Not Available
Honest Kitchen Grain Free Dog Food Review (Dehydrated),24%,15%,Not Available
Horizon Amicus Dog Food Review (Dry),30%,16%,Not Available
Horizon Legacy Dog Food Review (Dry),34%,15%,Not Available
Horizon Pulsar Dog Food Review (Dry),28%,15%,Not Available
Hubbard Life Dog Food Review (Dry),22%,12%,Not Available
Hungry Hound Dog Food Review (Dry),16%,6%,Not Available
Hunter’s Special Dog Food Review (Dry),24%,12%,Not Available
Husse Opus Ocean Dog Food Review (Dry),35%,16%,Not Available
I and Love and You Lovingly Simple Dog Food Review (Dry),30%,15%,Not Available
I and Love and You Naked Essentials Dog Food Review (Dry),30%,15%,Not Available
I and Love and You Nude Dog Food Review (Dry),34%,14%,Not Available
I and Love and You Stir and Boom Dog Food Review (Freeze-Dried Raw),22%,12%,Not Available
Iams Proactive Health Dog Food Review (Dry),25%,14%,Not Available
Inception Dog Food Review (Dry),25%,15%,Not Available
Infinia Dog Food Review (Dry),32%,16%,Not Available
Instinct Be Natural Dog Food Review (Dry),25%,14%,Not Available
Instinct Dog Food Review,37%,20%,Not Available
Instinct Limited Ingredient Diet Dog Food Review (Dry),26%,18%,Not Available
Inukshuk Dog Food Review (Dry),30%,25%,Not Available
Ivet Healthy Gourmet Dog Food Review (Dry),23%,13%,Not Available
Jack’s Premium Dog Food Review (Dry),31%,20%,Not Available
Jake’s Choice Dog Food Review (Dry),24%,20%,Not Available
Jinx Dog Food Review (Dry),27%,14%,Not Available
Joy Dog Food Review (Dry),26%,16%,Not Available
K9 Natural Freeze Dried Raw Dog Food Review (Freeze-Dried),48%,34%,Not Available
Kasiks Dog Food Review (Dry),28%,12%,Not Available
Kent Dog Food Review (Dry),27%,10%,Not Available
Kibbles ‘n Bits Dog Food Review (Dry),19%,8%,Not Available
Kinetic Performance Dog Food Review (Dry),30%,20%,Not Available
Kirkland Nature’s Domain Dog Food Review (Dry),24%,14%,Not Available
Kruse’s Dog Food Review (Dry),22%,10%,Not Available
Lassie Natural Way Dog Food Review (Dry),21%,12%,Not Available
Leonard Powell Signature Series Baked Dog Food Review (Dry),24%,12%,Not Available
Leonard Powell Signature Series Classics Dog Food Review (Dry),28%,16%,Not Available
Leonard Powell Signature Series Exotics Dog Food Review (Dry),28%,16%,Not Available
Life’s Abundance Dog Food Review (Dry),26%,16%,Not Available
Lifetime Dog Food Review (Dry),25%,15%,Not Available
LiveSmart Dog Food Review (Dry),24%,14%,Not Available
Lotus Dog Food Review (Dry),24%,12%,Not Available
Lotus Grain Free Dog Food Review (Dry),30%,12%,Not Available
Love Grub Dog Food Review (Dry),25%,15%,Not Available
Loyall Dog Food Review (Dry),26%,18%,Not Available
Loyall Life Dog Food Review (Dry),26%,16%,Not Available
Loyall Life Grain Free Dog Food Review (Dry),26%,15%,Not Available
Maximum Bully Dog Food Review (Dry),32%,22%,Not Available
Member’s Mark Dog Food Review (Dry),26%,14%,Not Available
Merrick Backcountry Raw Infused Grain-Free Dog Food Review (Dry),35%,17%,Not Available
Merrick Dog Food Review,26%,15%,Not Available
Merrick Grain Free Dog Food Review (Dry),32%,15%,Not Available
Merrick Lil’ Plates Dog Food Review (Dry),34%,15%,Not Available
Merrick Limited Ingredient Diet Dog food Review (Dry),23%,14%,Not Available
Mossy Oak Nature’s Menu Dog Food Review (Dry),26%,14%,Not Available
Muenster Ancient Grains Dog Food Review (Dry),30%,21%,Not Available
Muenster Perfect Balance Dog Food Review (Dry),24%,18%,Not Available
National Dog Food Review (Dry),26%,15%,Not Available
Native Performance Dog Food Review (Dry),30%,20%,Not Available
Natural Balance Fat Dogs Review (Dry),26%,8%,Not Available
Natural Balance Limited Ingredient Dog Food Review (Dry),20%,10%,Not Available
Natural Balance Original Ultra Whole Body Health Dog Food Review (Dry),23%,13%,Not Available
Natural Balance Vegetarian Dog Food Review (Dry),18%,8%,Not Available
Nature’s Logic Dog Food Review (Dry),34%,15%,Not Available
Nature’s Recipe Dog Food Review,22%,13%,Not Available
Nature’s Recipe Grain-Free Dog Food Review (Dry),27%,12%,Not Available
Nature’s Select Dog Food Review (Dry),25%,12%,Not Available
Nature’s Select Grain Free Dog Food Review (Dry),33%,16%,Not Available
Northwest Naturals Freeze Dried Raw Dog Food Review (Freeze-Dried),41%,34%,Not Available
Now Fresh Dog Food Review (Dry),27%,17%,Not Available
NRG The Raw One Dog Food Review (Dehydrated),26%,18%,Not Available
Nulo FreeStyle Dog Food Review (Dry),33%,18%,Not Available
Nulo Freestyle Freeze-Dried Raw Dog Food Review (Freeze-Dried),42%,28%,Not Available
Nulo Freestyle Limited Plus Dog Food Review (Dry),30%,18%,Not Available
Nulo Medal Series Dog Food Review (Dry),32%,17%,Not Available
Nunn Better Dog Food Review (Dry),21%,8%,Not Available
Nusentia Raw and Grain Free Dog Food Review (Dehydrated),22%,8%,Not Available
Nutra Nuggets Dog Food Review (Dry),26%,18%,Not Available
Nutram Ideal Solution Dog Food Review (Dry),24%,13%,Not Available
Nutram Sound Dog Food Review (Dry),24%,15%,Not Available
Nutram Total Grain Free Dog Food Review (Dry),32%,17%,Not Available
Nutreco Wholesome Blend Grain Free Dog Food Review (Dry),32%,18%,Not Available
Nutrience Grain Free Dog Food Review (Dry),34%,16%,Not Available
Nutrience Grain Free Subzero Dog Food Review (Dry),38%,18%,Not Available
Nutrience Infusion Dog Food Review (Dry),28%,18%,Not Available
Nutrience Original Dog Food Review (Dry),24%,14%,Not Available
NutriSource Dog Food Review (Dry),23%,14%,Not Available
NutriSource Grain Free Dog Food Review (Dry),25%,15%,Not Available
NutriSource PureVita Dog Food Review (Dry),24%,13%,Not Available
NutriSource PureVita Grain Free Dog Food Review (Dry),24%,16%,Not Available
Nutro Dog Food Review,24%,16%,Not Available
Nutro Limited Ingredient Diet Dog Food Review (Dry),22%,14%,Not Available
Nutro Ultra Dog Food Review (Dry),28%,19%,Not Available
NVC Dog Food Review (Dry),25%,14%,Not Available
NVC Grain Free Dog Food Review (Dry),30%,16%,Not Available
Ol’ Roy Dog Food Review (Dry),21%,10%,Not Available
Old Glory Dog Food Review (Dry),26%,18%,Not Available
Ole Jack’s Dog Food Review (Dry),21%,8%,Not Available
Only Natural Pet Canine PowerFood Dog Food Review (Dry),33%,17%,Not Available
Only Natural Pet EasyRaw Dog Food Review (Dehydrated),32%,8%,Not Available
Only Natural Pet MaxMeat Air Dried Dog Food Review (Dehydrated),36%,18%,Not Available
Only Natural Pet PowerFusion Dog Food Review (Dry),38%,18%,Not Available
Only Natural Pet RawNibs Dog Food Review (Freeze-Dried),55%,14%,Not Available
Only Natural Pet Wholesome Homemade Dog Food Review (Dehydrated),33%,12%,Not Available
Open Farm Grain-Free Dog Food Review (Dry),30%,14%,Not Available
Orijen Amazing Grains Dog Food Review (Dry),38%,18%,Not Available
Orijen Dog Food Review (Dry),38%,18%,Not Available
Orijen Dog Food Review | Canada (Dry),38%,18%,Not Available
Orijen Freeze-Dried Dog Food Review,40%,34%,Not Available
Oven-Baked Tradition Dog Food Review (Dry),25%,14%,Not Available
Oven-Baked Tradition Grain Free Dog Food Review (Dry),34%,18%,Not Available
Party Animal Dog Food Review (Dry),23%,14%,Not Available
Paw Tree Dog Food Review (Dry),24%,12%,Not Available
Paw Tree Grain Free Dog Food Review (Dry),28%,10%,Not Available
PC Nutrition First Dog Food Review (Dry),26%,15%,Not Available
Pedigree Dog Food Review (Dry),22%,10%,Not Available
Performatrin Ultra Dog Food Review (Dry),28%,14%,Not Available
Performatrin Ultra Grain Free Dog Food Review (Dry),37%,16%,Not Available
Pet Chef Express Dog Food Review (Dry),25%,14%,Not Available
Pet Pantry Dog Food Review (Dry),25%,14%,Not Available
Pet Shoppe Dog Food Review (Dry),21%,10%,Not Available
PetGuard Dog Food Review (Dry),27%,15%,Not Available
PetKind Tripe Dog Food Review (Dry),30%,16%,Not Available
PetWay Dog Food Review (Dry),25%,14%,Not Available
Pinnacle Grain Free Dog Food Review (Dry),26%,15%,Not Available
PMI Nutrition Dog Food Review (Dry),23%,16%,Not Available
Pride Dog Food Review (Dry),26%,18%,Not Available
Primal Freeze-Dried Formula Dog Food Review (Freeze-Dried),47%,25%,Not Available
Pro Pac Ultimates Dog Food Review (Dry),22%,12%,Not Available
Pro-Form Dog Food Review (Dry),27%,17%,Not Available
Pro-Pet Dog Food Review (Dry),26%,16%,Not Available
Professional Plus Dog Food Review (Dry),26%,15%,Not Available
Pronature Holistic Dog Food Review (Dry),24%,14%,Not Available
Pronature Holistic Grain Free Dog Food Review (Dry),30%,20%,Not Available
ProSeries Dog Food Review (Dry),26%,15%,Not Available
Pure Balance Dog Food Review (Dry),27%,15%,Not Available
Pure Balance Grain Free Dog Food Review (Dry),27%,16%,Not Available
Pure Harmony Dog Food Review (Dry),24%,12%,Not Available
Pureluxe Grain Free Dog Food Review (Dry),28%,18%,Not Available
Purina Beyond Dog Food Review (Dry),24%,14%,Not Available
Purina Beyond Superfood Blend Dog Food Review (Dry),26%,16%,Not Available
Purina Dog Chow Dog Food Review (Dry),21%,10%,Not Available
Purina One Dog Food Review (Dry),26%,16%,Not Available
Purina One True Instinct Dog Food Review (Dry),30%,17%,Not Available
Purina One True Instinct Grain Free Dog Food Review (Dry),30%,17%,Not Available
Purina Pro Plan Bright Mind Dog Food Review (Dry),29%,14%,Not Available
Purina Pro Plan Dog Food Review,26%,16%,Not Available
Purina Pro Plan Puppy Food Review (Dry),28%,13%,Not Available
Purina Pro Plan Sport Dog Food Review (Dry),30%,20%,Not Available
Purina Pro Plan Veterinary Diets EN Dog Food Review (Dry),23%,11%,Not Available
Purina Pro Plan Veterinary Diets HA Dog Food Review (Dry),18%,8%,Not Available
Purina Puppy Chow Review (Dry),28%,12%,Not Available
Q Holistic Dog Food Review (Dry),25%,16%,Not Available
Quality Care Plus Dog Food Review (Dry),26%,15%,Not Available
Rachael Ray Dog Food Review,23%,13%,Not Available
Rachael Ray Nutrish Dish Dog Food Review (Dry),26%,14%,Not Available
Rachael Ray Nutrish Limited Ingredient Dog Food Review (Dry),20%,13%,Not Available
Rachael Ray Nutrish Peak Dog Food Review (Dry),30%,15%,Not Available
Rachael Ray Nutrish Zero Grain Dog Food Review (Dry),26%,14%,Not Available
RAWZ Limited Recipe Dog Food Review (Dry),23%,12%,Not Available
RAWZ Meal Free Dog Food Review (Dry),40%,12%,Not Available
Real Meat Company Dog Food Review (Air-Dried),30%,23%,Not Available
Red Flannel Dog Food Review (Dry),26%,18%,Not Available
Redbarn Air Dried Dog Food Review (Dry),32%,22%,Not Available
Redbarn Grain Free Dog Food Review (Dry),28%,15%,Not Available
Redbarn Whole Grain Dog Food Review (Dry),26%,15%,Not Available
Redford Naturals Dog Food Review (Dry),24%,14%,Not Available
Redpaw PowerEdge Dog Food Review (Dry),32%,20%,Not Available
Redpaw X-Series Dog Food Review (Dry),26%,16%,Not Available
Regal Dog Food Review (Dry),25%,16%,Not Available
Renew Gold Balance Dog Food Review (Dry),26%,18%,Not Available
Retriever Dog Food Review (Dry),27%,15%,Not Available
Rex Dog Food Review (Dry),27%,15%,Not Available
River Run Dog Food Review (Dry),27%,15%,Not Available
Royal Canin Breed Health Nutrition Puppy Dog Food Review (Dry),27%,14%,Not Available
Royal Canin Dog Food Review,28%,11%,Not Available
Royal Canin Lifestyle Health Nutrition Urban Life Dog Food Review (Dry),23%,12%,Not Available
Royal Canin Size Health Nutrition Giant Dog Food Review (Dry),26%,18%,Not Available
Royal Canin Size Health Nutrition Large Dog Food Review (Dry),24%,15%,Not Available
Royal Canin Size Health Nutrition Medium Dog Food Review (Dry),23%,12%,Not Available
Royal Canin Size Health Nutrition Small Dog Food Review (Dry),25%,14%,Not Available
Royal Canin Size Health Nutrition X-Small Dog Food Review (Dry),22%,16%,Not Available
Royal Canin Veterinary Diets Selected Protein Dog Food Review (Dry),19%,10%,Not Available
Satori Dog Food Review (Dry),33%,17%,Not Available
Seminole Feed Dog Food Review (Dry),26%,18%,Not Available
Shep Dog Food Review (Dry),21%,10%,Not Available
ShowTime Dog Food Review (Dry),27%,20%,Not Available
Simply Nourish Grain Free Dog Food Review (Dry),27%,16%,Not Available
Simply Nourish Limited Ingredient Diet Dog Food Review (Dry),26%,13%,Not Available
Simply Nourish Original Dog Food Review (Dry),25%,13%,Not Available
Simply Nourish Source Dog Food Review (Dry),34%,15%,Not Available
Simply Right Dog Food Review (Dry),26%,14%,Not Available
Simply Right Exceed Dog Food Review (Dry),26%,15%,Not Available
Skoki Dog Food Review (Dry),26%,12%,Not Available
Sojos Complete Dog Food Review (Freeze-Dried),28%,12%,Not Available
Solid Gold Dog Food Review (Dry),24%,12%,Not Available
Solid Gold Grain Free Dog Food Review (Dry),30%,18%,Not Available
Sonny’s Pride Dog Food Review (Dry),26%,18%,Not Available
South Star Grain Free Dog Food Review (Dry),27%,13%,Not Available
Southern States Advanced Dog Food Review (Dry),26%,18%,Not Available
Southern States Naturals Dog Food Review (Dry),26%,16%,Not Available
Sport Dog Food Active Series Dog Food Review (Dry),30%,15%,Not Available
Sport Dog Food Elite Series Dog Food Review (Dry),30%,5%,Not Available
Sport Dog Food K-9 Series Dog Food Review (Dry),31%,22%,Not Available
Sportmix CanineX Dog Food Review (Dry),30%,22%,Not Available
Sportmix Original Dog Food Review (Dry),21%,8%,Not Available
Sportmix Premium Dog Food Review (Dry),26%,18%,Not Available
Sportsman’s Pride Dog Food Review (Dry),26%,18%,Not Available
Spot and Tango UnKibble Dog Food Review (Dry),27%,16%,Not Available
Spot Farms Grain Free Dog Food Review (Dehydrated),26%,16%,Not Available
SquarePet Dog Food Review (Dry),41%,21%,Not Available
Star Pro Dog Food Review (Dry),27%,12%,Not Available
Stella and Chewy’s Freeze Dried Dinners Dog Food Review (Freeze-Dried),48%,28%,Not Available
Stella and Chewy’s Raw Blend Dog Food Review (Dry),36%,15%,Not Available
Stella and Chewy’s Raw Coated Kibble Dog Food Review (Dry),27%,17%,Not Available
Strongpoint Dog Food Review (Dry),24%,15%,Not Available
Summit Dog Food Review (Dry),23%,11%,Not Available
Sundays Food for Dogs Review (Dehydrated),30%,20%,Not Available
Supreme Source Dog Food Review (Dry),26%,11%,Not Available
Taste of the Wild Ancient Grains Dog Food Review (Dry),32%,18%,Not Available
Taste of the Wild Dog Food Review,32%,18%,Not Available
